{
  "job_id": "phase0-schema-freeze",
  "phase": 0,
  "task_type": "schema_definition",
  "intent": "Freeze Phase 0 schemas (jobspec, validation_error, ledger) and add fixtures/tests.",
  "inputs": {
    "schemas": [
      "CATALYTIC-DPT/SCHEMAS/jobspec.schema.json",
      "CATALYTIC-DPT/SCHEMAS/validation_error.schema.json",
      "CATALYTIC-DPT/SCHEMAS/ledger.schema.json"
    ]
  },
  "outputs": {
    "durable_paths": [
      "CATALYTIC-DPT/SCHEMAS/jobspec.schema.json",
      "CATALYTIC-DPT/SCHEMAS/validation_error.schema.json",
      "CATALYTIC-DPT/SCHEMAS/ledger.schema.json"
    ],
    "validation_criteria": {
      "schemas_validate": true,
      "fixtures_exist": true
    }
  },
  "catalytic_domains": [
    "CATALYTIC-DPT/_scratch"
  ],
  "determinism": "deterministic",
  "swarm_parallel": false,
  "metadata": {
    "created_at": "2025-12-24T00:00:00Z"
  }
}
