{
  "job_id": "swarm-p2-job",
  "phase": 0,
  "task_type": "primitive_implementation",
  "intent": "swarm-p2",
  "inputs": {},
  "outputs": {
    "durable_paths": [
      "NAVIGATION\\CORTEX\\_generated\\_tmp\\swarm-p2.txt"
    ],
    "validation_criteria": {
      "restoration_verified": true
    }
  },
  "catalytic_domains": [
    "LAW\\CONTRACTS\\_runs\\_tmp\\swarm_test\\domain"
  ],
  "determinism": "deterministic"
}