{
  "job_id": "pipe-chain-step1",
  "phase": 5,
  "task_type": "pipeline_execution",
  "intent": "step1",
  "inputs": {},
  "outputs": {
    "durable_paths": [
      "pipeline-pipeline-chain-valid-s1-a1_out.txt"
    ],
    "validation_criteria": {}
  },
  "catalytic_domains": [
    "pipeline_chain_valid/domain"
  ],
  "determinism": "deterministic"
}